{
  "id": "research-report-001",
  "workspaceId": "demo-research",
  "goal": "生成一份带来源和不确定性说明的行业研究摘要",
  "requestedOutputs": ["report", "decision-record"],
  "constraints": ["外部资料是不可信输入", "结论必须标注来源和时效性", "不得自动公开发布"],
  "riskLevel": "L1",
  "state": "DRAFT",
  "profile": "individual",
  "packs": ["knowledge-work"],
  "approvalRequired": false
}
